Text,language
barocco pt escândalo de ª página é um filme francês dirigido por andré téchiné estreado em  e protagonizado por gérard depardieu e isabelle adjani,Portugese
diante destes gerenciamentos podendo ser feitos pela própria empresa mais comum em média e grandes empresas ou até mesmo por empresas terceiras especializadas em monitoramento de redes noc é notável o ganho de agilidade e eficiência em prol dos objetivos da empresa,Portugese
besemer s van der geest v murray j bijleveld c c j h and farrington d p  the relationship between parental imprisonment and offspring offending in england and the netherlands british journal of criminology  -,Portugese
in  johnson was awarded an american institute of architects gold medal in  he became the first recipient of the pritzker architecture prize the most prestigious international architectural award,English
"poço de jacó está localizado a  metros de tell balata na parte oriental da cidade de nablus dentro do recinto do mosteiro de bir yaqub o poço é localizado na entrada da igreja nos terrenos do mosteiro e descendo as escadas até a cripta onde o poço é conservado junto com ""um pequeno guincho um balde ícones de ex-votos e muitas velas acesas"" a tumba de josé está localizado ao norte do poço de jacó em um prédio da era otomana marcado por uma cúpula branca",Portugese
bussy-saint-georges has built its identity on a green model environment with parks and gardens they represent  hectares of integrated green spaces  kilometres  miles of soft connecting links  squares and parks in the city centre  pools and more than  trees today,English
katie nasceu e cresceu na cidade de middlebury no condado de new haven estado de connecticut seus pais são clara e mark stevens katie ainda tem um irmão chamado ryan stevens se formou na pomperaug high school na cidade de southbury connecticut em junho de ,Portugese
segundo o censo de  jiribam tinha uma população de  habitantes os indivíduos do sexo masculino constituem  da população e os do sexo feminino  jiribam tem uma taxa de literacia de  superior à média nacional de  a literacia no sexo masculino é de  e no sexo feminino é de  em jiribam  da população está abaixo dos  anos de idade,Portugese
o troço da linha de sines entre o quilómetro  e santiago do cacém foi inaugurado em  de junho de  os convidados partiram às  horas da estação ferroviária do sul e sueste em lisboa atravessando o rio tejo no barco évora entre os convidados estava o ministro das obras públicas duarte pacheco e o seu chefe de gabinete carlos alves o director geral do ministério raul da costa couvreur o chefe da divisão de construção rodrigo severiano monteiro os representantes da direcção da companhia dos caminhos de ferro portugueses luís costa manuel gonçalves constantino schrdëter de carvalho joaquim barros júlio dos santos e henrique bravo henrique peyssoneau joaquim bravo mendes barata jorge nunes o director geral dos caminhos de ferro álvaro de sousa rego o presidente do conselho de administração da cp vasconcelos correia o chefe do serviço de movimento barbosa pita o representante da junta autónoma das estradas jorge moreira e o professor antónio jacinto de vilhena que foi um dos principais impulsionadores da construção da linha de sines foram recebidos na estação do barreiro pelo governador civil de setúbal mário cais esteves que acompanhou a comitiva até santiago do cacém e por outras altas individualidades o comboio inaugural que partiu do barreiro era,Portugese
minnesotas state parks are spread across the state in such a way that there is a state park within  miles  km of every minnesotan the most recent park created is lake vermilion state park created in  currently the parks range in size from franz jevne state park with  acres  ha to saint croix state park with  acres  ha two parks include resources listed as national natural landmarks big bog state recreation area and itasca state park and six parks encompass national historic landmarks charles a lindbergh fort snelling mille lacs kathio st croix soudan underground mine and split rock lighthouse state parks  sites or districts across  minnesota state parks are on the national register of historic places nrhp including  parks with developments constructed by new deal-era job creation programs in the s,English
pessoas que eram contra os muckers passaram a ser assassinadas e os crimes foram atribuídos aos muckers em  de maio de  aconteceu a grande reunião na casa dos maurer com a presença estimada de  a  pessoas jacobina anunciou o fim do mundo e ordenou o extermínio de dezesseis famílias inimigas em  de junho aconteceu o massacre da família kassel o casal maurer teve mandado de prisão decretado em  de junho catorze casas de inimigos foram queimadas e dez pessoas foram mortas inclusive crianças,Portugese
nordahl road is a station served by north county transit districts sprinter light rail line it straddles the city limits of san marcos and escondido california with its mailing address in escondido the station is located between barham drive and auto park waynordahl road both of which intersect east mission road it consists of a single platform and track,English
a talk by takis fotopoulos about the internationalization of the capitalist market economy and the project of inclusive democracy a talk given by takis fotopoulos at the university of vermont in  followed by a discussion in which murray bookchin dan chodorkoff and others take part video in  parts retrieved  january ,English
while running a campaign to elect his sister sherry martschink to lieutenant governor in  shealy with the help of robert kohn recruited unemployed black fisherman benjamin hunt jr to run for congress against republican arthur ravenel jr shealy sought to increase the turnout of white voters by playing to the racial fears of the south carolina electorate he promised hunt who had a prior drug arrest $ to run for congress and paid for his $ filing fee shealy paid for the fees with an unreported $ campaign contribution to his sister from laidlaw environmental services,English
reynolds was born in wiesbaden germany where his father a career military man was stationed he says he hails from nowhere because the family moved so often his family lived many places including germany a farm in indiana an army base in alaska kansas and missouri where he lived longer than any other place until he was old enough to move away as an adult both parents were extremely devout christians and he says he grew up with christian music all around him however his older sister owned some albums from the beatles which he says even as a very young child he loved instantly playing air guitar to their music,English
além de sua beleza natural olinda é também um dos mais importantes centros culturais do brasil foi declarada em  patrimônio histórico e cultural da humanidade pela organização das nações unidas para a educação a ciência e a cultura,Portugese
"since the days of the revolution a one-room stone schoolhouse had stood on a grassy area known as the common located close to the present intersection of south orange avenue and academy street in maplewood in  this building blocked the construction of a new toll highway from newark to morristown the  ""proprietors and associates"" of the school met on august  of that year and resolved to erect a new school building near the site of the old one naming seven trustees to thereafter oversee the education of local children the resolution reflected ""the desire of the meeting that the said school should in the future have the name of columbian school of south orange""",English
"obreption and subreption both from the latin word reporeptum genitive meaning to creep or crawl the prefix ob- means ""towards against or in the way of"" sub- means ""under or close to"" are terms used in ancient roman law and in the canon law applied by the catholic church to species of fraud by which an ecclesiastical rescript is obtained",English
the boys soccer team was coached by gene chyzowych one of the most successful active scholastic soccer coaches in the nation the  boys soccer team won the north ii group iv state sectional championship with a − win over westfield high school in the tournament final,English
aberllefenni is a village in the south of gwynedd wales it lies in the historic county of merionethshiresir feirionnydd in the valley of the afon dulas,English
de acordo com relatos alguns os quais da própria vera sílvia alguns membros de mr- tiveram de deixar a casa onde viviam após serem denunciados por uma vizinha ela e josé acabaram cercados pela polícia e entre os muitos tiros de fuzil ele acabou sendo atingido a militante conseguiu escapar também ferida em um táxiao olhar para trás ainda pode vê-lo se levantando do chão bastante machucado e ensaguentado atirando contra dois policiais e depois correndo rua abaixo fazendo o caminho inverso de vera que seguiu para um outro local onde havia combinado de reencontrá-lo caso se separassem em alguma missão josé porém nunca apareceu ao chegar a um prédio onde moravam outros integrantes da mesma organização acabou sendo visto por um militar que desconfiando de seu estado o denunciou o militante então pegou a arma de um de seus companheiros e esperou pelo chegada de seus captores,Portugese
cornus canadensis canadian dwarf cornel canadian bunchberry quatre-temps crackerberry creeping dogwood is a species of flowering plant in the cornaceae dogwood family native to eastern asia japan korea northeastern china jilin province and the russian far east the northern united states colorado new mexico canada and greenland unlike its relatives which are for the most part substantial trees and shrubs c canadensis is a creeping rhizomatous perennial growing to about  cm  in tall,English
em abril de  a liga argelina de direitos humanos relatou  cabilas mortos  feridos dos quais  tornaram-se permanentemente inválidos e milhares de detenções maus tratamentos tortura e prisões arbitrárias,Portugese
eleito vice-prefeito de natal em  na chapa encabeçada por wilma de faria foi eleito deputado federal pelo pfl em  sendo reeleito em   e ,Portugese
o palácio do luxemburgo palais du luxembourg em francês é um palácio localizado no º arrondissement de paris na frança actualmente é a sede do senado da frança,Portugese
utilizou-se vasta base de dados dos crimes cometidos no reino unido acerca de carreiras criminais individuais para se obter insights analíticos ademais foram captadas diferentes facetas das carreiras criminais sendo elas a categoria de baixo risco e baixa frequência frequência é representada pela letra grega lâmbida ƛ criminal b categoria de alto risco e baixa-ƛ c categoria de alto risco e alta-ƛ,Portugese
reynolds has a son josef born in february  with his wife linna in  he and girlfriend diane thomas had a daughter eura they resided in new mexico with her son jostin bileyu in  thomas moved with their children to north carolina tim followed to be near his daughter eura he currently resides in north carolina after living for  years in virginia and several years in new mexico on august st  reynolds married kristin nienkirchen in turks and caicos,English
the other more probable account starts in  when schyrleus is born in reutte austria after joining the augustine order in  he is sent to the university at ingolstadt where he probably follows courses in astronomy and learns how to grind lenses following his graduation he does not return to his convent but enters the capuchin order which sends him to linz in  where he is to teach philosophy here he comes in the service of kurfürst philipp christoph von sötern the archbishop of trier and speyer who is held captive by the emperor ferdinand iii the archbishop sends him on a mission to negotiate with pope urban viii the emperor however seeing this diplomatic activity as a form of spying bans schyrleus from his lands in [] from here on both accounts of schyrleus life come together,English
"there was a reaction to these changes complaints arose over so-called ""fads and frills""-inessentials said to be leading to the neglect of reading writing spelling and arithmetic new york papers read by local commuters campaigned for a return to the efficiency of the ""little old red schoolhouse"" but the changes were here to stay",English
o estudo considerou características comuns de transgressores de modo a identificar padrões de comportamento ademais o estudo aborda também questões relativas à racionalidade da punição a qual leva em consideração a duração entre o início da carreira criminal e a expectativa de término da mesma visto que não haveria sentido em se aplicar pena superior à duração residual da referida carreira,Portugese
"""west coast reggae group stick figure debuts first-ever music video for fire on the horizon track exclusive premiere"" billboard november  ",English
after a few months hearst provided information not on oath sworn testimony could have been used to convict her of sla activities to the authorities a bomb exploded at hearst castle in february after hearst testified that wolfe had raped her emily harris gave a magazine interview from prison alleging hearst retaining a trinket given to her by wolfe was an indication that she had been in a romantic relationship with him hearst said she had kept the stone carving because it seemed to be a pre columbian artifact of archeological significance harriss interpretation was used by the prosecutor james l browning jr and some jurors later said they regarded the carving which browning waved in front of them as powerful evidence that hearst was lying,English
a prática da antiguidade não pode ser caracterizada como heráldica no senso mais estrito da palavra embora esteja em sua raiz e em essência almeje os mesmos objetivos como hoje é conhecida a heráldica se articulou lentamente na europa medieval consolidando-se em torno do século xii padronizando usos regionais diferenciados através de uma série de regras que no geral ainda se mantém em vigor servindo como um identificador de pessoas famílias lugares nações e expondo publicamente conquistas ideologias valores dignidades pertencimentos e ligações de parentesco da mesma forma povos indígenas de várias partes do mundo bem como culturas muito antigas e sofisticadas como a japonesa e a árabe desenvolveram sistemas de simbolismos visuais que de muitas maneiras são comparáveis à heráldica europeia tanto nas formas de codificação da linguagem como no uso e na ampla difusão mas produzindo emblemas e signos que para os ocidentais parecem decididamente exóticos e não-familiares,Portugese
o hospital geriátrico e de convalescentes d pedro ii situado na avenida guapira nº  faz parte da irmandade da santa casa de misericórdia de são paulo foi fundado em  com o nome de asilo de medicina municipal asilo dos inválidos como era conhecido popularmente no sítio guapira atual bairro do jaçanã,Portugese
"o alto acre foi fundado no dia  de março de  criado para representar os municípios da região do alto acre capixaba assis brasil brasiléia epitaciolândia e xapuri no entanto uniformes distintivo e cores oficiais só foram determinados no ano seguinte quando o clube adquiriu o status de ""clube profissional"" e garantiu sua participação na primeira divisão do campeonato acriano terminou em quinto lugar",Portugese
"a canção até agora única que já recebeu críticas positivas universalmente pitchfork media deu à canção uma revisão positiva uma avaliação a faixa [ dos  possíveis] e dizendo ""acapella"" é um bom donna summer estilo faixa com kelis como uma rainha electro gelada um abraço de robótica metronomic felicidade da casa aboutcom s ""dance music"" revista a faixa favorável chamando a canção ""majesty"" e nomeou-o seu ""song of the day"" entertainment weekly chamou a canção uma ""delícia pista de dança penas"" e colocou a música no seu ""o mustlist"" para  enquanto billboard magazine adicionou a música para o seu best bits  do ""anúncio"" nick levine da digital spy foi mais do que impressionado com a música ele disse ""william tem sido um menino ocupado ultimamente mas qual é a melhor coisa que ele fez por nós - o novo single de usher [omg]? nah ""meet me halfway""? hmm  talvez assinatura kelis  bingo dizemos isto porque ""acapella"" é possivelmente a fatia mais sublime do pop clube vamos ouvir todo o ano sobre bate-bate banheira  kelis proporciona uma homenagem sincera a seu filho bebê knight  ""before you my whole life was acapella"" ela jorra sobre o coro quase hinário ""before you my whole life was acapella"" o resultado é tão edificante tão cheio de energia e emoção ela não apenas fa",Portugese
martins joão brion madalena sousa miguel et al  o caminho de ferro revisitado o caminho de ferro em portugal de  a  lisboa caminhos de ferro portugueses  páginas cs manut uso explícito de et al link cs manut nomes múltiplos lista de autores link,Portugese
the film introduces a romance involving wyatt earp and a fictional character based on lottie deno which played no factor in the actual gunfight nor did anything to advance the films plot,English
"em  o site foi indicado ao prêmio toddy de música independente na categoria ""veículo online"" oferecido pela revista dynamite com o patrocínio da toddy e ficou em º lugar e em  o site foi indicado ao prêmio dynamite de música independente oferecido pela revista dynamite",Portugese
foi criado cardeal-presbítero no consistório de  de dezembro de  entrou em roma a partir de sua legação na germânia em  de fevereiro de  recebeu o chapéu vermelho em consistório público em  de fevereiro de  e recebeu o título de são clemente em  de março de  o papa pio ii o nomeou núncio a latere em marca de ancona em setembro de  ocupando o cargo até sua morte abade commendatario do mosteiro de s abbondio como em ,Portugese
"o aeródromo de braga código iata bgz código oaci lpbr surgiu através de progressivas transformações de antigos campos de lavoura e bouças na freguesia de palmeira designado como ""campo de aviação"" nome pelo qual ainda é reconhecido o actual aeródromo inaugurado a  de junho de  com a aterragem dum avião militar monomotor ""junker -f"" pilotado pelo capitão amado da cunha",Portugese
a obra “explaining criminal careers” consiste em um estudo teórico e empírico acerca da construção de uma carreira criminal de modo a produzir profundo e abrangente conhecimento acerca do transgressor assim esse conhecimento adquirido poderá ser utilizado de modo a estruturar as políticas públicas de combate ao crime de forma racional,Portugese
with the national team he played in the  world cup qualifiers in australia where iraq finished second behind the hosts the  and  asian cups in thailand and iran and in the olympic qualifiers in  and  douglas was also an important part of the iraqi army team that won the  and  cism world military championship,English
former deathwish professional antwuan dixon was imprisoned in mid- and stated in a july  thrasher magazine interview—conducted by reynolds and ellington—that he was scheduled to be released on august   dixon also explained that he may be released earlier,English
nangal jiwan is a village in nakodar in jalandhar district of punjab state india it is located  kilometres  mi from nakodar  kilometres  mi from kapurthala  kilometres  mi from district headquarter jalandhar and  kilometres  mi from state capital chandigarh the village is administrated by a sarpanch who is an elected representative of village as per panchayati raj india,English
olinda é município integrante do grande recife consórcio de transporte metropolitano empresa que fiscaliza o transporte público por ônibus na região metropolitana do recife o município possui em operação  terminais de ônibus integrados eles possuem área coberta lanchonete e sanitários nos terminais os passageiros têm a possibilidade de trocar de linha sem pagamento de nova tarifa,Portugese
demotic ownership of productive resources is a kind of ownership which leads to the politicisation of the economy the real synthesis of economy and polity this is so because economic decision making is carried out by the entire community through the demotic assemblies where people make the fundamental macro-economic decisions which affect the whole community as citizens rather than as vocationally oriented groups eg workers as eg in parecon at the same time workers apart from participating in the demotic decisions about the overall planning targets would also participate in the above broad sense of vocationally oriented groups in their respective workplace assemblies in a process of modifyingimplementing the democratic plan and in running their own workplace,English
foi protagonizada por jacqueline bracamontes jaime camil e valentino lanus e antagonizada por karla álvarez fabiola campomanes e sabine moussier,Portugese
as máquinas de moldagem por injeção também conhecidas como prensas mantêm os moldes em que os componentes são moldados as prensas são avaliadas por tonelagem o que expressa a quantidade de força de aperto que a máquina pode gerar esta pressão mantém o molde fechado durante o processo de injeção,Portugese
several romance languages use the latin word acrifolium turned into aquifolium in modern time so italian agrifoglio occitan grefuèlh etc,English
"o criador mike judge disse que originalmente imaginou beavis e butt-head como estudantes delinquentes do colégio existente highland high school na coal avenue em albuquerque novo méxico onde ele morava especificamente ele criou butt-head como sendo sua visão de um tipíco delinquente colegial incorporando o visual o nome e a voz de um amigo que convidava todo mundo para chutá-lo no traseiro e que se nomeava ""traseiro-de-ferro"" ""iron-butt""",Portugese
entre  e  realizou sessões de jazz com merle saunders e de  a  participou da banda ruby gravando  discos sua discografia solo apesar de vasta e bem conceituada por críticos da música é pouco conhecido e divulgada até os dias atuais mesmo para muitos fãs de creedence,Portugese
avital haim selinger haifa  de março de  é um ex-jogador de voleibol dos países baixos que competiu nos jogos olímpicos de  e ,Portugese
"in october  the american civil liberties union filed a complaint against columbia high school and the south orange-maplewood school district in relation to its academic leveling and disciplinary systems stating that the overuse of discipline and ""zero-tolerance"" policy and implicit racial bias within the level selection system violate title vi of the civil rights act of  and section  of the rehabilitation act of  claims were made that the suspension rate for black students was five times higher than that for white students in a classroom environment in which black students were significantly underrepresented in ap and honors classes",English
farrington trabalha na área de desenvolvimento criminológico e desde  vem trabalhando num estudo em cambridge sobre funcionários delinquentes os resultados desse estudo mostraram que as carreiras criminosas mais comuns começam sem um curso preparatório e que a idade média dos criminosos geralmente varia entre  e  anos das entrevistas com os sujeitos de  anos de idade foi observado que em todos mesmo nos reincidentes as anormalidades sociais decresceram indicando aumento da integração social,Portugese
daley era esperado para enfrentar carlos condit em  de janeiro de  no ufc  no entanto condit teve que se retirar do card devido à um sério corte na mão ele foi substituído por dustin hazelett,Portugese
este tratamento por conter um adjetivo que não se refere a qualquer patamar de nobreza é inferior ao tratamento puro de majestade mas mesmo assim é superior ao de majestade sereníssima,Portugese
azmuth revela que o verdadeiro propósito do omnitrix foi permitir que os diversos seres do universo entendessem a vida na pele um do outro e para ressuscitar espécies inteligentes extintas,Portugese
muitos anos antes patti teve uma boa experiência em paris com o compositor de óperas de bel canto gioacchino rossini que era um grande defensor dos valores tradicionais do canto italiano,Portugese
its in the rain é uma canção da cantora irlandesa enya foi lançada como segundo single do álbum amarantine no ano de  em alguns países europeus,Portugese
"posto que a coenzima a é quimicamente um tiol pode reagir com os ácidos carboxílicos para formar tioésteres de modo que atue como um portador de grupo acilo uma molécula de coenzima a que leva um grupo acetilo é referida como acetil-coa quando não está unida a um grupo acetilo é referida geralmente como ""coash"" o ""hscoa"" quando a coenzima a se une ao acetil ela permite que ele seja degradado pelas enzimas do ciclo de krebs o qual ocorre posteriormente a degradação da mesma",Portugese
"em março de  quando henry maundrell visitou o poço de jacó a profundidade da água no poço media  m edward robinson visitou o local em meados do século xix descrevendo os ""restos da antiga igreja"" encontrando-se um pouco acima do poço para o sudoeste como uma ""massa disforme de ruínas entre as quais são fragmentos de cinza colunas de granito ainda mantendo o seu antigo polimento"" os cristãos locais continuaram a venerar o lugar mesmo quando ele estava sem uma igreja em  o local foi adquirido pelo patriarcado ortodoxo grego e uma nova igreja dedicada à santa fotina foi construída em  um terremoto veio destruir o templo",Portugese
