Text,language
dleón studied nine years at the escuela nacional de bellas artes in nicaragua under its director rodrigo peñalba his early inspiration were the frescos of pompeii where he saw the use of cross-hatching and applied this technique to his love of the impressionist school,English
relatório da repartição dos negócios do império apresentado à assembléia geral legislativa na ª sessão da ª legislatura pelo respectivo ministro e secretário de estado cândido josé de araújo viana ,Portugese
"gary hart started out as a wrestler in  in chicago at the marigold arena in the late s he became a manager called ""playboy"" gary hart during the late s he managed the spoiler as well as the tag team duo the spoilers which consisted of spoilers  don jardine and  smasher sloan they won several tag team titles in  and  under harts guidance",English
no juvenil os simplistas jogam duas fases de qualificatório mas só os que passam à chave principal pontuam em duplas a pontuação é por jogador a partir da fase com  os competidores recebem pontos adicionais de bônus os valores da tabela já somam as duas pontuações,Portugese
"disc  concentrates on post-ska rocksteady and reggae tracks recorded between  and  such as toots  the maytals ""do the reggay"" ""monkey man"" and ""pressure drop"" as well jimmy cliffs ""wonderful world beautiful people"" and ""many rivers to cross the slickers ""johnny too bad"" like several of the other tracks on this compilation were featured in the movie the harder they come starring jimmy cliff and its soundtrack album tony tribe does a rendition of ""red red wine"" originally written and performed by neil diamond which later became a hit for ub",English
thor eisentrager is a founding member and former guitarist for the minneapolis-based noise rock-outfit the cows after the release of the cowss ninth album sorry in pig minor thor announced that he had grown tired of touring and left the band the remaining members disbanded shortly thereafter he is currently retired from the music business and works as the assistant director of security for the minneapolis institute of art,English
a arena é frequentemente selecionado pela ncaa para eventos de campeonato e foi palco para os quatro campeonatos de hóquei no gelo da ncaa em abril de  dos quatro campeonatos de basquete feminino em  e dos campeonatos de luta profissional da ncaa em       ,Portugese
the minnesota woman suffrage association mwsa was an organization devoted to womens suffrage in minnesota from  to  the organization struggled to secure womens right to vote its members organized marches wrote petitions and letters gathered signatures gave speeches and published pamphlets and broadsheets to force the minnesota legislature to recognize their right to vote due to their efforts the legislature approved the nineteenth amendment in ,English
a decadência do império romano significou a decadência da cultura legada da grécia e do oriente a astrologia caiu para um estado de superstição fato que levou a igreja católica a condená-la ignorando as referências astrológicas no evangelho de lucas os reis magos e no apocalipse assim agostinho de hipona que estudara astrologia a renega após sua conversão,Portugese
itapetininga é um município do estado de são paulo no brasil sede da região de governo de itapetininga e membro da região metropolitana de sorocaba sua estimativa populacional em  era de  habitantes,Portugese
"the artificial market however is rarely advocated as the only element for the allocation of goods and services by its proponents as most also support a form of directly democratic planning for non-commercial goods and vital resources and in some cases regulation of the artificial market through planning also in the ids system of allocation of resources ""the artificial market complements the envisaged direct democratic planning mechanism in the allocation of all goods and services on the basis of the crucial distinction introduced in this model between basic and nonbasic goods and services""",English
"harold edward ""harry"" wright  june  – april  was an english professional footballer and manager who played as a goalkeeper in the football league for charlton athletic aldershot and derby county and managed the india national team between  and ",English
melodic é uma publicação diária online sueco devota à crítica e comentários musicais notícias sobre música e entrevistas a artistas foca-se na música independente incluindo o música rock no entanto cobre também música electrónica pop dance folk jazz e música experimental,Portugese
após sua vitória sobre jorge masvidal daley assinou um contrato de várias lutas com o strikeforce e fez sua estréia promocional contra scott smith em  de dezembro de  no strikeforce henderson vs babalu ii smith andou para frente e daley conectou um soco de esquerda mandando smith inconsciente para o chão aos  do primeiro na entrevista pós-luta ele pediu pelo peso leve kj noons,Portugese
o museu grévin é um museu de cera em paris localizado no boulevard montmartre junto ao hard rock café fundado em  por arthur meyer alfred grévin e gabriel thomas é um dos museus de cera mais antigos da europa algumas da estátuas são de napoleão iii de frança penélope cruz elton john céline dion papa joão paulo ii e madre teresa de calcutá,Portugese
taking over a team with only one returning starter he led the racers to a - season and second-place finish in the ohio valley conference his next two squads won  and  games again placing second in the conference regular-season standings and advanced as far as the ovc tournament semifinals,English
quiet but deadly monica caine literally has not uttered a single word since the spontaneous manifestation of her psionic abilities which she utilized to become indoctrinated in the bloodpool,English
"american public schools were all significantly impacted by world war ii in the words of lt general brehon sommervell then commanding general services of supply ""the job of the schools in this total war is to educate the nations manpower for war and for the peace that follows"" columbia high school met the challenge primarily with curriculum changes designed to prepare boys for service in the military the science department developed courses in aeronautics in biology students studied the effect of flying on the human body a new modern history course emphasized the ""historical background for an understanding of the forces which have caused this global war of the necessity of destroying that for which our enemies stand and of the magnitude of the international problems which face the world"" even the music department offered a new program ""to train pupils in the informal singing that grows out of wartime needs"" columbia had its own victory corps with the objective of encouraging pupils ""to take some active part in their own communitys war effort while they are yet in school",English
supporters also claim that ids institutional framework offers the best hope for a better human relationship to nature than could ever be achieved in a market economy or one based on socialist statism the factors supporting this view refer to all three elements of an inclusive democracy political economic and social,English
beto é na verdade filho de patricio fruto de uma relação enganosa de patricio quando ainda era noivo de candy patricio vai viver também em guadalajara onde descobre que beto é seu filho  então pensa em se relacionar novamente com soledade e com beto o que faz com que cada vez mais ele esteja perto de candy e salvador váva mesmo nem podendo imaginar,Portugese
quando a peça está finalizada tem-se início a pressão de recalque essa pressão de recalque tem como finalidade manter o material compactado até que ocorra a completa solidificação para não ocorrer contração na peça a intensidade da pressão e o tempo de atuação dependem de alguns fatores como,Portugese
no entanto muitos escudos apresentam por vezes duas formas distintas uma complexa e outra simplificada reduzida ao escudo propriamente dito o que sucede por vezes quando há pouco espaço para inserir o brasão de armas maior inúmeros países apresentam assim as chamadas armas maiores e armas menores veja-se o caso de portugal,Portugese
a península de onsala – em sueco onsalahalvön - é uma península na comuna de kungsbacka na província histórica da halland no sul da suécia,Portugese
full disclosure requires that full details of a security vulnerability are disclosed to the public including details of the vulnerability and how to detect and exploit it the theory behind full disclosure is that releasing vulnerability information immediately results in better security fixes are produced faster because vendors and authors are forced to respond in order to protect their system from potential attacks as well as to protect their own image security is improved because the window of exposure the amount of time the vulnerability is open to attack is reduced the issue of full disclosure was first raised in a th-century controversy over the revelation of lock-system weaknesses to the public according to a c hobbs,English
"when goodrem was  years old her first manager glenn wheatley signed her to an artist development deal with independent label empire records to see if she possessed potential as a recording artist between june  to june  she worked with producers paul higgins and trevor carter on thirteen tracks for an album called delta which saw ""an ambitious -year-old keen to emulate the pop sound of the spice girls britney spears and mandy moore"" most tracks were written by carter although goodrem did co-write a couple of tracks including the sole-penned ""love"" goodrem did a photoshoot for the album some of the photos have surfaced and recorded a home-made style music video for the song ""say"" which has since leaked onto the internet higgins took the album to roadshow who offered to market and distribute the album but the deal was knocked back by goodrems parents in september  goodrem signed to sony music and the album was shelved a year later goodrem released her debut single ""i dont care"" and in late  released her breakthrough international hit ""born to try"" with many number ones to follow",English
vougy é uma comuna francesa na região administrativa de ródano-alpes no departamento de doubs estende-se por uma área de  km² em  a comuna tinha   habitantes densidade  habkm²,Portugese
during his tenure at the mossad he helped carry out operation wrath of god the israeli response to the munich massacre and dealt with the lead up and aftermath of the yom kippur war in  after the german government refused to accept an israeli team during the munich hostage crisis zamir was sent to observe any activities he was at the fürstenfeldbruck airbase the night that the failed rescue attempt left all nine remaining israeli hostages dead zamir was interviewed about the incident in  when he spoke with the producer of one day in september a documentary on the massacre in it he strongly criticized the german rescue effort for its complete lack of coordination he had previously been interviewed on this subject for an nbc profile during their coverage of the  barcelona olympics and he has discussed the massacre several times since zamir currently resides in zahala a neighborhood in the north of tel aviv,English
over at columbia coburn was in a swinging sixties heist film duffy  which flopped he was one of several stars who had cameos in candy  then played a hitman in hard contract  for fox another flop,English
page is also interested in the socio-economic effects of advanced intelligent systems and how advanced digital technologies can be used to create abundance as described in peter diamandis book provide for peoples needs shorten the workweek and mitigate the potential detrimental effects of technological unemployment,English
copérnico ao propor o heliocentrimo recuperava o conhecimento de aristarco tycho-brahe viria com suas acuradas observações dos movimentos planetários na dinamarca a fornecer dados para comprovar a teoria de copérnico kepler foi assistente de tycho-brahe em seu concerning the more certain fundamentals of astrology  expõe em  teses a forma como o sol a lua e os planetas influenciam os acontecimentos na terra,Portugese
amade baba al-massufi al-timbucti ahmad baba al-massufi al-tinbukti nome completo abul abas amade ibne amade al-tacruri al-massufi al-timbucti abu al-abbas ahmad ibn ahmad al-takruri al-massufi al-timbukti  de outubro  - também conhecido como amade baba o sudanês ahmed baba es sudane foi um escritor erudito e provocador político medieval na área então conhecida como sudão ocidental na áfrica ocidental,Portugese
trabalhou com maestros como alan gilbert seiji ozawa kurt masur pierre boulez leonard slatkin stanislaw skrowaczewski peter oundjian esa-pekka salonen myung-whun chung e gianandrea noseda,Portugese
january   - the town of saganoseki was merged into the expanded city of ōita kita-amabe district was dissolved as a result of this merger,English
in  while traveling to a peace summit between the united states china and russia air force one is hijacked by a domestic terrorist posing as a stewardess the president is given a tracking bracelet and his briefcase containing an audiotape describing the secret to using nuclear fusion for power generation handcuffed to his wrist he makes it to an escape pod and lands in manhattan just before air force one crashes killing everyone else aboard,English
ponto  centro da ponta a maior parte dos autores usam só ponta mas se encontra mais frequentemente confirmação da definição de ponta às vezes encontra-se pé,Portugese
após a queda da catalunha minorca a única das baleares sob controle da república foi isolada de qualquer outro território republicano pelo bloqueio naval dos nacionalista o general francisco franco prometeu ao governo britânico que as tropas italianas de mussolini iriam abandonar as ilhas baleares após a guerra se o governo britânico concordasse em organizar a rendição da guarnição republicana,Portugese
on the first anniversary of september th the sacramento news  review brought together musical acts from different faith groups around sacramento for a call for unity event to symbolize the citys acceptance of racial and religious diversity every year someone in the region was honored with a building unity award for their interfaith work in sacramento until  when the last call for unity event was held,English
no princípio dos anos  kirkup assentou em andorra continuou o seu trabalho e correspondência notavelmente tornando-se um contribuidor frequente para a secção de obituários no jornal britânico the independent até  também teve vários livros virtuais publicados na internet pelo brindin press um grande encorajador de jovens talentos em todos os aspectos das artes foi o presidente honorário da companhia de teatro de jovens,Portugese
on leaving colchester in the summer of  wright was appointed trainer-coach at guildford city after qualifying as an fa coach and physiotherapist wright would hold coaching positions at walsall and luton town before being appointed head coach of first division everton in september ,English
"as of july  the bloomberg billionaires index lists page as the th richest man in the world with an estimated net worth of $ billion at the completion of  fortune magazine named page its ""businessperson of the year"" declaring him ""the world’s most daring ceo""",English
rollin on the river began in  as a community concert series and has evolved into one of renos largest free summer music events rollin on the river is held in wingfield park an island amphitheater on the truckee river during the month of july and features both local and regional touring artists,English
the indian social system was influenced by the concept of varna varna is not caste and caste is not varna this is a critical difference not understood by many it directly linked religious belief and the segregation of society into status groups weber goes on to describe the varna system the brahmins - priests the kshatriyas - warriors the vaishyas - merchants the shudras - laborers and the untouchables,English
em  mudou-se para o sul para gloucestershire e tornou-se poeta visitante na academia de arte de bath durante os três anos seguintes mudando-se para bath ensinou numa escola de gramática em londres antes de deixar inglaterra em  para viver e trabalhar na europa américa e oriente no japão encontrou aceitação e apreciação no seu trabalho e assentou lá durante  anos ensinadoliteratura inglesa em várias universidades,Portugese
garden state  the school is both shown and referenced in this zach braff film which was partly filmed in neighboring south orange new jersey and millburn new jersey,English
april michelle bowlby vallejo  de julho de  é uma atriz norte-americana conhecida principalmente por ter interpretado stacy barrett em drop dead diva onde atuou ao lado da atriz brooke elliott cuja personagem era jane bingum,Portugese
"""always on time"" is the second single by american rapper ja rule from his third studio album pain is love the song would feature american rb singer ashanti and was produced by irv gotti the song was written by  aurelius ja rule and irving lorenzo the song became a worldwide hit and was ashantis first hot  number one single and ja rules second",English
"a vida pessoal de patti não teve tanto sucesso quanto sua vida profissional mas não foi mais desastrosa que a de muitos cantores de óperas havia rumores dela ter um romance com o tenor mario já que ele se gabava de ter feito ""amor com ela muitas vezes""",Portugese
in september  as part of the continuum  artists series an exhibit of her work opened in new york city and the george gustav heye center of the national museum of the american indian the exhibit included blanket stories a sculpture made of two towers of wool blankets with each stack sewn together with a central thread she collected the blankets over several years including many hudsons bay point blankets that were given to native americans in trade by the hudsons bay company during the th century,English
em  por ordem do estado novo várias igrejas portuguesas que eram do estilo gótico e que tinham sido ornamentadas com o estilo barroco tiveram grandes obras no intuíto de se lhe restituírem o estilo original o góticoesta igreja também lhe foram retirados alguns elementos de barroco principalmente os  retábulos de talha dourada pertencentes à abside e ao transepto entre outros vestígios do barroco,Portugese
o ciclone extratropical remanescente de melor tornou-se uma das mais intensas tempestades a atingir a costa oeste dos estados unidos da história a tempestade provocou chuvas fortes em toda a região no condado de monterey a precipitação acumulada máxima chegou a  mm a cidade de san francisco califórnia registrou as mais intensas chuvas num período de  horas em toda a história as chuvas intensas causaram o bloqueio de rodovias e a interrupção do fornecimento de eletricidade para mais de  pessoas,Portugese
johnson was born in cleveland ohio on july   the son of a cleveland lawyer homer h johnson he was descended from the jansen family of new amsterdam and included among his ancestors the huguenot jacques cortelyou who laid out the first town plan of new amsterdam for peter stuyvesant he attended the hackley school in tarrytown new york and then studied as an undergraduate at harvard university where he focused on learning greek philology history and philosophy particularly the work of the pre-socratic philosophers upon completing his studies in  he made a series of trips to europe visiting the landmarks of classical and gothic architecture and joined henry-russell hitchcock a prominent architectural historian who was introducing americans to the work of le corbusier walter gropius and other modernists in  he met german architect ludwig mies van der rohe who was at the time designing the german pavilion for the  barcelona international exposition the meeting formed the basis for a lifelong relationship of both collaboration and competition,English
"moreover many hundreds of hybrids and cultivars have been developed for garden use among them the very popular ""highclere holly"" ilex × altaclerensis i aquifolium × i perado and the ""blue holly"" ilex × meserveae i aquifolium × i rugosa hollies are often used for hedges the spiny leaves make them difficult to penetrate and they take well to pruning and shaping",English
in  a partnership with the north valley community foundation and matching small community donations has helped support investigative journalism in butte county california,English
em  olinda foi tomada pelos holandeses que a incendiaram no ano seguinte em  os portugueses retomaram o poder e expulsaram os holandeses olinda voltou a ser capital de pernambuco muito embora os governadores residissem em recife por volta de  com a fundação do seminário diocesano e em  do curso jurídico transformou-se num burgo de estudantes,Portugese
"from the name of his grandson c sabucius maior plotinus faustinus who set up an inscription in his memory it is clear his gentilicum is ""sabucius maior"" ""sabucius"" is a rare etruscan nomen anthony birley provides two other known individuals of that gens suggesting his origins lay in italy and not one of the provinces",English
"the palace brand was founded around  in england united kingdom by lev tanju who was part of a london-based skate crew known as the palace wayward boys choir tanju enlisted the assistance of friends like graphic designer fergus ""fergadelic"" purcell also design director at marc by marc jacobs and photographer will bankhead to launch the brand tanju explained in  ""i just wanted to make some skateboards that looked nice and skated nice""",English
"hearst reported ""i spent fifteen hours going over my sla experiences with dr robert jay lifton of yale university dr lifton author of several books on coercive persuasion and thought reform  pronounced me a classic case which met all the psychological criteria of a coerced prisoner of war  if i had reacted differently that would have been suspect he said""",English
entre  e  a fpf convidou equipes estrangeiras para participarem da disputaboca juniors argentina peñarol uruguai cerro porteño paraguai nagoya grampus eight e yomiuri verdy ambos do japão além das seleções sub- do japão e da china os primeiros clubes estrangeiros a participarem da competição foram o providencia do méxico em  o vélez sársfield da argentina em  e  e o bayern de munique da alemanha em  como todas elas caíram na primeira fase a organização da copinha abandonou a ideia mas em  uma nova equipe estrangeira foi convidada para a disputa o al-hilal da arábia saudita em  o kashiwa reysol por motivo de patrocínio participou da competição e foi a primeira equipe estrangeira a passar de fase,Portugese
courcy-aux-loges é uma comuna francesa na região administrativa do centro no departamento loiret estende-se por uma área de  km² em  a comuna tinha  habitantes densidade  habkm²,Portugese
haddad initially followed the hanafi school of sunni jurisprudence after his conversion to islam but later adopted the shafii school of sunni jurisprudence he stated he did so because  he found it easier to study due to shaykh nuh keller’s reliance of the traveler  he found it more logical to practice because it is the main school of jurisprudence in lebanon and because it is the school his wife follows and  the founder of the school imam shafii was a member of the quraysh tribe the tribe of muhammad and muhammad had told his followers to hold fast to the quran and the members of his household,English
farrington d p a age period cohort and offending in gottfredson dm and clarke rv eds policy and theory in criminal justice contributions in honour of leslie t wilkins aldershot gower pp -,Portugese
in tombstone wyatt finds out that ike clanton is trying to herd thousands of head of rustled mexican cattle but cannot as long as the earps control tombstones railway station morgan earp deforest kelley criticizes his brothers association with holliday but wyatt insists the gunslinger is welcome in tombstone as long as he stays out of trouble cotton the cowardly county sheriff from fort griffin offers wyatt a $ bribe about $ today if he allows the stolen cattle to be shipped but wyatt refuses he rides out to the clanton ranch returning young billy clanton dennis hopper to his mother after finding billy drunk wyatt informs ike that he has been made a us marshal and has legal authority in every county in the united states finding no recourse the clantons decide to ambush wyatt as he makes his nightly rounds but kill his younger brother james earp martin milner by mistake,English
the armistice of salonica also known as the armistice of thessalonica was signed on  september  between bulgaria and the allied powers in thessaloniki the convention followed after a request by the bulgarian government on  september asking for a ceasefire the armistice effectively ended bulgarias participation in world war i on the side of the central powers and came into effect on the bulgarian front at noon on  september the armistice regulated the demobilization and disarmament of the bulgarian armed forces,English
page is an investor in tesla motors he has invested in renewable energy technology and with the help of googleorg googles philanthropic arm promotes the adoption of plug-in hybrid electric cars and other alternative energy investments,English
