Text,language
in his youth he moved to bernalda in the province of matera he begun his military career on october   and began attending courses at the military academy in modena and studied at the carabinieri school in rome graduating in law he was editor-in-chief of il carabiniere the monthly magazine published by the arms of carabinieri,English
"the pairs mission was ""to organize the world’s information and make it universally accessible and useful"" with a us$-million loan from friends and family the inaugural team eventually moved into a mountain view office by the start of  in  page experimented with smaller sized server units so that google could fit more into each square meter of the third-party warehouses that the company rented to store their servers which eventually led to a search engine that ran much faster than googles competitors at the time",English
" an artificial market using personal vouchers which ensures freedom of choice but avoids the adverse effects of real markets although some have called this system ""a form of money based on the labour theory of value"" it is not a money model since vouchers cannot be used as a general medium of exchange and store of wealth",English
o novo posto fronteiriço da portas do cerco entre a região administrativa especial de macau e o território continental da república popular da china foi aberto a  de janeiro de ,Portugese
o campo de um escudo na heráldica pode ser dividido em mais de um esmalte do mesmo modo as várias figuras do escudo muitas cotas de armas consistem simplesmente de uma divisão do escudo em dois esmaltes contrastantes como estas são consideradas partições do escudo a regra da contrariedade das cores pode ser ignorada por exemplo um escudo dividido em partições azure e goles seria perfeitamente aceitável a linha que divide o escudo em partições pode ser reta ou seguir padrões — serrilhados ondulados dentados ou diversos outros,Portugese
"in september  page launched the independent calico initiative a rd project in the field of biotechnology google announced that calico seeks to innovate and make improvements in the field of human health and appointed art levinson chairman of apples board and former ceo of genentech to be the new divisions ceo pages official statement read ""illness and aging affect all our families with some longer term moonshot thinking around healthcare and biotechnology i believe we can improve millions of lives""",English
o último encontro entre ambas equipes foi em  de abril de  válido pela quarta rodada do torneio primera división  e o resultado foi de x pela unión no estádio do unión,Portugese
columbia high school has a series of clubs the columbian is a club where students write a newspaper for students and staff of columbia high school that includes topics from in the school itself but also includes current events from around the world the paper was recognized by the american scholastic press association in - with first place in its scholastic newspaper awards,English
"fotopoulos describes inclusive democracy as ""a new conception of democracy which using as a starting point the classical definition of it expresses democracy in terms of direct political democracy economic democracy beyond the confines of the market economy and state planning as well as democracy in the social realm and ecological democracy in short inclusive democracy is a form of social organisation which re-integrates society with economy polity and nature the concept of inclusive democracy is derived from a synthesis of two major historical traditions the classical democratic and the socialist although it also encompasses radical green feminist and liberation movements in the south""",English
os nomes usados na brasonaria lusófona para as cores e metais provêm principalmente do francês os mais comuns são jalde ou or ouro argento prata blau ou azure azul gules vermelho sable preto sinopla ou vert verde e purpure púrpura outras cores são utilizadas ocasionalmente normalmente para finalidades especiais,Portugese
através desta ligação de autocarro serve mais comodamente os alunos da fep fdup feup eseipp que assim saem do transporte comodamente junto às suas faculdades,Portugese
a história da suíça propriamente dita começa a  de agosto de  com os habitantes de uri schwyz e unterwalden a unirem-se contra os habsburgos da áustria através da bundesbrief carta de aliança a união destes três cantões era denominado waldstätte e habitado principalmente por camponeses servos e nobres este permaneceu durante muito tempo sobre a proteção do sacro império romano-germânico até à subida dos habsburgos ao poder,Portugese
podemos fazer a mesma coisa durante anos sem contudo perceber outras formas de realizá-las além daquela que se assentou em nossas práticas e o pensamento lateral caso o tenhamos desenvolvido estimula a uma nova perspectiva permitindo assim modos diferenciados de execução de tarefas costumeiras novos insights novos métodos e técnicas,Portugese
during world class golden era hart was also a manager in the georgia and mid-atlantic regions of the nwa joining these two areas exclusively in  shortly after the start of the freebirds-von erichs feud when he left world class due to a pay dispute hart returned to texas in the summer of  and following a short hiatus in  stayed with the federation until  hart was also a promoter and manager in san antonio for texas all-star wrestling the successor of joe blanchards southwest championship wrestling scw group he also worked for the icw first as the heel manager of bruiser brody kevin sullivan and mark lewin during one storyline hart had a falling out with sullivan after which lewin attacked hart with a sleeper hold,English
"anton or antonius maria schyrleus also schyrl schyrle of rheita – in czech antonín maria šírek z reity was an astronomer and optician he developed several inverting and erecting eyepieces and was the maker of kepler’s telescope ""things appear more alive with the binocular telescope"" he wrote ""doubly as exact so to speak as well as large and bright""[] his binocular telescope is the precursor to our binoculars",English
foi ministro da fazenda e ministro da justiça conselheiro de estado deputado geral presidente de província e senador de  a  eleito pela província de minas gerais ocupou a presidência do senado de  a ,Portugese
tracy spencer e carlos após uma tentativa frustrada de deixar springwood decidem descansar em uma casa abandonada nas proximidades que se transforma em  elm street a casa anterior de nancy thompson e jesse walsh enquanto isso john e maggie visitam o orfanato de springwood e descobrem que freddy teve um filho john acredita que ele é o filho de freddy pois permitiu-lhe viver de volta a elm street carlos e spencer adormecem e tornam-se vítimas de freddy tracy é despertada por maggie mas john que entrou no mundo dos sonhos com tracy para tentar ajudar spencer ainda está dormindo maggie e tracy decidem levá-lo de volta para o abrigo no entanto no caminho de volta krueger mata john em seu sonho mas não antes de revelar que o filho de krueger é uma menina como john morre ele revela esta informação para maggie tracy e maggie retornam ao abrigo mas elas descobrem que ninguém se lembra de john spencer ou carlos exceto doc que aprendeu a controlar seus sonhos maggie lembra o que john disse-lhe e acha seus próprios papéis de adoção descobrindo que ela é filha de freddy cujo verdadeiro nome é katherine krueger,Portugese
zvi zamir hebrew צבי זמיר‎ born zvicka zarzevsky born  was a major general in the israel defense forces and the director of the mossad from  to  born in poland zamir immigrated with his family to the then british mandate of palestine when only seven months old at the age of  zamir began his military career first as a soldier in the haganahs palmach a unit that included future israeli leaders among the likes of moshe dayan and yitzhak rabin during the  arab–israeli war zamir fought in the newly created israel defense forces after the war he continued climbing the chain of command eventually promoted to the commander of the southern command his final idf post before being appointed mossad director came in  when he was appointed the military attaché to london,English
texas am hired kennedy in may  after mark turgeon left for the maryland head coaching job kennedy previously coached at am from - kennedy stated at the press conference that am is his destination job and he plans to retire there he was given the honors of sec mens basketball coach of the year in ,English
grace mirabella  de junho de  nova jérsei eua é uma jornalista de moda ex-editora-chefe da revista vogue norte-americana de  a ,Portugese
o álbum the face da cantora sul-coreana de música pop boa debutou em primeiro lugar tornando-a a segunda artista após ayumi hamasaki a ter seis álbuns número um consecutivos desde a sua estréia na primeira posição das paradas o álbum hard candy da cantora de música pop madonna é o primeiro álbum da artista a debutar na primeira posição na parada da oricon em  anos com o lançamento do seu segundo álbum game o girl group perfume tornou-se o segundo grupo de technopop após yellow magic orchestra a ter um álbum número um na parada,Portugese
nascida no rio de janeiro é formada em desenho industrial e começou sua carreira de atriz aos  anos de idade dedicou-se aos estudos da arte dramática fazendo oficinas de ator com fátima toledo eduardo wotzik camila amado marcio libar christiane jatahy andré paes leme domingos oliveira yoshi oida gerald thomas josie antello moacir chaves juliana carneiro da cunha cláudia câmara luis mello daniel herz e suzana kruguer antunes filho denise courtouké moacyr góes leon góes david herman josé possi neto paulo betti luis de lima e elias andreato,Portugese
as guerras romano-latinas foram uma série de guerras gravadas entre a roma antiga incluindo tanto o reino de roma quanto a república romana e as tribos latinas dos primeiros anos da história de roma até a subjugação final dos latinos a roma depois da segunda guerra latina,Portugese
a anedota retrata com vivacidez os papéis esperados pelos gêneros abordando a hipocrisia as fraquezas inerentes ao homem e a inconstância dos sentimentos femininos sendo uma alegoria para a própria sociedade romana,Portugese
barocco é uma obra feita num ambiente de melodrama de filme negro um filme que trabalha o duplo impossível e no entanto real sobre a transformação da repulsa fascinada em amor convulsivo é uma obra onde por toda a parte o écran se desdobra em outros écrans descobrindo assim dentro de si outros efeitos ficcionais ou seja outras encenações as janelas montras cartazes écrans de televisão ou ainda os espaços organizados como palcos a grande sala da piscina de sauna o barco o restaurante o ring de boxe,Portugese
o álbum best fiction da cantora de rb namie amuro teve o maior longest-running de  o álbum permaneceu no topo da parada de  de agosto a  de setembro namie amuro tornou-se a primeira artista solo feminina em  anos a ter um álbum na primeira posição por seis semanas consecutivas após saki kubota que teve um álbum na primeira colocação por sete semanas consecutivas em  o álbum greatest hits expressions da cantora pop mariya takeuchi ficou no topo da tabela por três semanas consecutivas fazendo dela a primeira artista com mais de  anos a realizar esse fato,Portugese
philip johnson architectural drawings - bulk -held by the department of drawings  archives avery architectural  fine arts library columbia university,English
"avco embassy pictures the films financial backer preferred either charles bronson or tommy lee jones to play the role of snake plissken to carpenters choice of kurt russell who was trying to overcome the ""lightweight"" screen image conveyed by his roles in several disney comedies carpenter refused to cast bronson on the grounds that he was too old and because he worried that he could lose directorial control over the picture with an experienced actor at the time russell described his character as ""a mercenary and his style of fighting is a combination of bruce lee the exterminator and darth vader with eastwoods vocal-ness"" all that matters to snake according to the actor is ""the next  seconds living for exactly that next minute is all there is"" russell used a rigorous diet and exercise program in order to develop a lean and muscular build he also endeavored to stay in character between takes and throughout the shooting as he welcomed the opportunity to get away from the disney comedies he had done previously he did find it necessary to remove the eyepatch between takes as wearing it constantly seriously affected his depth perception",English
a velocidade de injeção é o tempo para preencher a cavidade do molde com o material fundido entretanto para um menor tempo de injeção para preencher a cavidade do molde maior será a velocidade de injeção assim recomenda-se uma velocidade de injeção média - rápida evitando a solidificação da peça antes de terminar o processamento pois caso isso ocorra causará falhas na peça,Portugese
ilex mucronata formerly the type species of nemopanthus is native to eastern north america nemopanthus was treated as a separate genus with eight species of the family aquifoliaceae now transferred to ilex on molecular data it is closely related to ilex amelanchier,English
"em  ele entrou para o faces do subúrbio e era conhecido apenas por garnizé antes disso porém ele foi baterista do grupo de thrash metal ""the ax""",Portugese
farrington d p b psychosocial predictors of adult antisocial personality and adult convictions behavioural sciences and the law  -,Portugese
orner along with actress cate blanchett was one of only two australians nominated for an oscar in  most commentators predicted that michael moores sicko would win the best documentary category however to the surprise of many orners taxi to the dark side which examines us torture practices in afghanistan iraq and guantanamo bay received the award,English
de acordo com lívio em  ac os volscos e os latinos uniram suas forças em sátrico o exército romano comandado pelos tribunos consulares públio valério potito publícola e lúcio emílio mamercino marcharam contra eles a batalha que se seguiu foi interrompida no primeiro dia por uma tempestade no segundo os latinos resistiram aos romanos por algum tempo pois já conheciam suas táticas mas uma carga de cavalaria desmantelou as linhas latinas e quanto a infantaria romana deu sequência ao ataque o exército latino foi derrotado volscos e latinos recuaram primeiro para sátrico e depois para âncio os romanos perseguiram mas não tinham armas de cerco para atacarem âncio depois de uma discussão sobre continuar a guerra ou pedir a paz as forças latinas partiram e os ancianos renderam sua cidade aos romanos furiosos os latinos atearam fogo a sátrico e queimaram a cidade toda exceto o templo de mater matuta — uma voz vinda do interior do templo teria ameaçado uma terrível punição se o fogo não fosse mantido longe do santuário em seguida os latinos atacaram túsculo que tomada de surpresa foi tomada com exceção da cidadela um exército romano liderado pelos tr,Portugese
the berliner joyce design a conventional biplane of mixed metal and fabric construction with staggered wings and the pilot and observer seated in tandem in open cockpits first flew in may  by that time the rival xok- was already destroyed in a crash following trials that lasted into  buaer awarded berliner-joyce a contract,English
candy tem um filho que batiza como salvador váva como ela tem muito carinho devido a que considera que seu filho é seu salvador candy pensa em trabalhar no restaurante de seu tio manuel o qual é homossexual e foi expulso da família por ter essa condição sexual,Portugese
inspired by his tempestuous relationships with his wives anna gordy and janis hunter gaye added more of a personal depth in the songs he recorded for the album,English
o livro comunicação de interesse público que reúne uma série de artigos acadêmicos aborda em alguns capítulos campanhas organizadas pela secretaria de comunicação social secom do governo federal a análise avalia exemplos de cip bem-sucedida como as campanhas “o melhor do brasil é o brasileiro” e “aids o front da informação” de acordo com o artigo escrito por cristina gutemberg flamínio fantini e flávio serpa os altos índices de óbitos pela doença decorrente do vírus hiv provocaram uma abordagem qualificada como sinistra e condenadora por parte da comunicação em geral a partir de  com a reestruturação das diretrizes as novas campanhas passaram a promover a precaução em vez de apelar para a evidência de mortes essa guinada para um sentido completamente oposto e muito mais empático ajudou a consolidar – ao longo de cinco mandatos de presidentes – a importância do uso de preservativos e a ajudar na redução significativa do número de indivíduos infectados no país,Portugese
all  tracks were written and produced by woodruff one of which features vocal by reggae singer half pint and one of which features vocals from woodruffs close friend tj oneill woodruff cowrote five of the tracks with oneill the two had spent time traveling abroad together in indonesia australia fiji thailand and new zealand starting in  finding mutual inspiration for songwriting,English
president jimmy carters commutation of her federal sentence to the  months served freed hearst eight months before she would have had a parole hearing the  release was under stringent conditions and she remained on probation for the state sentence on the surplus store plea president ronald reagan reportedly gave serious consideration to pardoning hearst she recovered full rights when president bill clinton granted her a pardon on january   his last day in office,English
europacorp has international rights to the film which will be released through europacorps new distribution company red relativity europacorp distribution stxfilms will distribute it in the united states,English
"in addition to ""dream warriors"" the single contained the songs ""back for the attack"" a previously unreleased track and ""paris is burning"" from the album breaking the chains",English
two months after her release from prison hearst wed bernard lee shaw – a policeman whom she had met when he was part of a dozens-strong private security detail protecting her on bail the marriage lasted until his death in  they had two children gillian and lydia hearst-shaw hearst became prominent on the east coast society and charitable fundraising scene and was particularly involved with a foundation helping children suffering from aids,English
b securing freedom of choice in a marketless moneyless and stateless ‘scarcity–society’ which has not yet achieved universal autarky self-sufficiency,English
it is a member of the common stonechat superspecies but it is distinct together with its closest relative the madagascan stonechat s sibilla being insular derivatives of the african stonechat its ancestors probably diverged from the sub-saharan african lineage as it spread across the continent some - mya during the late pliocene,English
james falconer kirkup frsl  de abril de  –  de maio de  foi um poeta inglês tradutor e escritor de viagens escreveu mais de  livros incluindo autobiografias novelas e peças tornou-se membro da real sociedade de literatura em ,Portugese
blumstein a farrington dp and moitra s  delinquency careers innocents desisters and persisters in tonry m and morris n eds crime and justice an annual review of research vol  chicago university of chicago press pp -,Portugese
in  tom hamilton also began playing with joe russo dave dreiwitz marco benevento and scott metzger in a grateful dead tribute band called joe russos almost dead,English
inclusive democracy id is a project that aims for direct democracy economic democracy in a stateless moneyless and marketless economy self-management democracy in the social realm and ecological democracy,English
farrington d p b later adult life outcomes of offenders and non-offenders in brambring m losel f and skowronek h eds children at risk assessment longitudinal research and intervention berlin de gruyter pp -,Portugese
em  o alto acre terminou o campeonato estadual na sétima colocação com a segunda pior campanha fazendo o mesmo número de gols do último colocado apenas  em  piorou o seu rendimento e caiu para a segunda divisão do estadualem  o clube disputou a série a mesmo caindo no ano atrás pois um clube foi banido da competiçao nesse ano o clube ficou na ª posição e no ano de  em º lugar,Portugese
at the beginning of  kent music report was renamed as the australian music report it was used by major record companies in preference to arias own charts kent continued production of his music reports until  and sold off his interests in the australian music report which continued to the end of  when changes in technology such as barcoding enabled point-of-sale information to be sent directly to aria this meant that he could no longer compile reliable sales information,English
"by the s he had formed the ""tim reynolds three"" or tr and had added other influences to his repertoire music from nine inch nails bob marley and marilyn manson in addition he continued to learn to play other instruments including the sitar sarod the mandello keytar tubular bells and other ""exotic"" instruments that are not commonly seen in western rock artists of the rock and roll musicians of the time",English
"in june  writer tamar lewin of the new york times wrote ""growing up growing apart"" a lengthy feature highlighting how an ethnically diverse trio struggled to maintain friendships and cope with teen life at columbia the story trailed aqeelah mateen an african-american muslim kelly regan an irish catholic and johanna perez-fox a puerto rican jew the group quickly became ambassadors for the school and for their respective ethnic groups the article wasnt controversial per se but directed national attention to the school district and to columbia specifically",English
in - shealy was one of the political consultants hired by thomas ravenel of charleston in his unsuccessful multimillion-dollar run in the republican primary for us senate,English
"no início de  a banda lançou o seu décimo álbum de estúdio lost highway um cd com bastante influência country-rock que aliás sempre esteve presente na carreira da banda clássicos como ""wanted dead or alive"" ""dry county"" ""blaze of glory"" carreira solo de jon e a mais recente ""who says you cant go home"" fizeram e ainda faz muito sucesso jon sempre admitiu que adora música country e levando em conta esses clássicos e o último feito da banda de ser a primeira banda de rock a ficar em primeiro lugar na parada country com a música ""who says you cant go home"" resolveram então fazer um cd bem diferente do que vinham fazendo sem deixar o espírito hard rock de lado o cd foi um sucesso mundial e com apenas  semanas de seu lançamento a banda conquistou o primeiro lugar na billboard - coisa que não acontecia com os garotos de new jersey há  anos",Portugese
at fox he was second-billed in the pirate film a high wind in jamaica  supporting anthony quinn he had a cameo in the loved one ,English
"durante a ocupação germânica de paris - hermann göring ocupou o palácio usando-o como qurtel general da luftwaffe em frança tomou para si próprio um sumptuoso conjunto de salas para acomodá-lo nas suas visitas à capital francesa o seu subordinado o marechal de campo da luftwaffe hugo sperrle também ocupou um apartamento e passou a maior parte da guerra gozando as luxuosas cercanias ""a paixão do marechal de campo pelo luxo e pela exibição pública corre de perto com a do seu superior göring ele também estava compatível em corpulência"" escreveu o ministro do armamento albert speer depois de uma visita a sperrle em paris",Portugese
in val-de-bussy of marne-la-vallée bussy-saint-georges is from  the leading and main support of the built-up area as a real and independent new town french ville nouvelle with a unique status of local and new town the others towns decided to be organized around a common agglomeration system of new towns,English
since minnesota state parks and trails are authorized by the state legislature some trails have been established in state statute yet no usable mileage has been constructed,English
"em tempos mais recentes tem-se discutido a possibilidade de ser outra a origem da astrologia a civilização do vale do indo ou harapana em comum essas duas civilizações compartilham a ênfase no papel das estrelas pano de fundo e baliza do movimento do sol e da lua em harappa teria se originado o conceito de nakshatra sânscrito ""os imortais"" manazil árabe ou mansão lunar que mais tarde daria origem ao zodíaco em ambas regiões o sol causticante não é como na fria europa o doador da vida e sim a lua com as marés que provoca no mundo físico e nos seres vivos portanto os nakshatras mediam a passagem da lua pelo céu sendo cada um destes asterismos a medida de arco média percorrida pela lua em um dia",Portugese
in october  business insider reported that pages paralyzed vocal cords are caused by an autoimmune disease called hashimotos thyroiditis and prevented him from undertaking google quarterly earnings conference calls for an indefinite period,English
setareki tawake born  march  in kavala kadavu is a retired fijian rugby union player who was capped for fiji on  occasions he played as openside flanker or number  he played in two rugby world cups he was also a soldier,English
