Text,language
a segunda corrida acontece no domingo e o grid é decidido pelo resultado de sábado com top  sendo invertido sendo assim o piloto que obteve o oitavo lugar no sábado larga na pole position e o vencedor sai da oitava posição,Portugese
la jonchère at the beginning of the th century this was a great farm the owner was m martin de longchamps who also owned fontenelles it was a féculerie in  which dominated all the intensive potato production in the region unfortunately from  potato blight affected the activity and then completely stopped it the farmers decided to replace it with sugar beet the domaine de la jonchère was used for establishing the installations of the new product,English
a distância de cada corrida é decidida antes de cada evento entretanto deve-se correr o número determinado de voltas dentro do tempo limite de  minutos não sendo completado o número de voltas vence quem receber a bandeirada ao final do tempo,Portugese
illinois route  is an east–west state road in northern illinois it runs from the intersection with illinois route  north of lanark east to illinois route  harlem avenue in chicago this is a distance of  miles  km,English
a bout between russias eldar eldarov and irelands peter queally from sbg ireland was in the works for this card but queally didnt reach an agreement with brave and eldar ended up facing kevin koldobsky also from sbg,English
in  crossgen published john carpenters snake plissken chronicles a four-part comic book miniseries the story takes place a day or so after the events of escape from new york snake has been given a military humvee after his presidential pardon and makes his way to atlantic city although the directors cut of escape from new york shows snake was caught after a bank job this story has snake finishing up a second heist that was pre-planned before his capture the job entails stealing the car in which john f kennedy was assassinated from a casino before delivering it to a buyer in the gulf of mexico snake partners with a man named marrs who ends up double crossing him left for dead in a sinking crab cage snake escapes and is saved by a passing fisherman named captain ron an in-joke referring to kurt russells  comedy captain ron when ron denies snakes request to use his boat in order to beat marrs to the robbery snake decides to kill him when snake ends up saving ron from the russian mob who wants money ron changes his mind and helps snake once at the casino snake comes face-to-face with marrs and his men who arrive at the same time ending in a high-spee,English
a família de jacobina já tinha um histórico de envolvimento em contendas religiosas na alemanha os avós imigraram para o brasil fugindo de perseguições religiosas ambos deixaram a igreja evangélica e a escola e estabeleceram uma comunidade religiosa independente com mais seis ou sete famílias o que culminou na sua perseguição em seu encontro com a imperatriz leopoldina o avô de jacobina confidenciou-lhe que viera para o brasil fugindo da repressão religiosa na alemanha e a imperatriz lhe garantiu que no brasil eles teriam garantida a liberdade de culto,Portugese
lapampasaurus cholinoi é uma espécie de dinossauro da família hadrosauridae é a única espécie descrita para o gênero lapampasaurus seus restos fósseis foram encontrados na formação allen província de la pampa argentina e datado do cretáceo superior do final do campaniano ao início do maastrichtiano,Portugese
"the first komsomol shock construction project was announced for the blast furnace  later became known as ""komsomolskaya"" at the magnitogorsk iron and steel works in - the last construction project was an air converting rolling mill for hot rolling at the same magnitogorsk iron and steel works in -",English
"daley pediu desculpa por seus atos após voltar ao reino unido dizendo que koscheck havia provocado-o empurrando-o na grade mas isso não ""há desculpa"" para uma ""decisão precipitada"" ele foi suspendido por  dias pela comissão atlética de quebec",Portugese
fairy tail gaiden kengami no souryuu spin-off de fairy tail contada na perspectiva de sting rougue minerva yukino e dos outros membros da guilda sabertooth,Portugese
"page attended the okemos montessori school now called montessori radmoor in okemos michigan from  to  and graduated from east lansing high school in  he attended interlochen center for the arts as a saxophonist for two summers while in high school page holds a bachelor of science in computer engineering from the university of michigan with honors and a master of science in computer science from stanford university while at the university of michigan page created an inkjet printer made of lego bricks literally a line plotter after he thought it possible to print large posters cheaply with the use of inkjet cartridges—page reverse-engineered the ink cartridge and built all of the electronics and mechanics to drive it page served as the president of the beta epsilon chapter of the eta kappa nu fraternity and was a member of the  ""maize  blue"" university of michigan solar car team as an undergrad at the university of michigan he proposed that the school replace its bus system with a prt system which is essentially a driverless monorail with separate cars for every passenger he also developed a business plan for a company that would use software to b",English
de modo geral para determinar a pressão de injeção ideal inicia-se a injeção com pressão baixa e aumentar gradualmente até se obter peças de boa qualidade,Portugese
the quarry reservoir llyn cob was once known as llyn owain lawgoch after the last male survivor of the princely house of the kingdom of gwynedd,English
"takis fotopoulos ""globalisation and the multi-dimensional crisis the inclusive democracy approach"" theomai journal no  nd semester  retrieved  january ",English
"in the s he was a professor of philosophy at trier in  he was in cologne conducting astronomical observations and optical measurements and in  his work novem stellae circa jovem visae circa saturnum sex circa martem nonnullae ""nine stars seen around jupiter six around saturn several around mars"" appeared in  he published oculus enoch et eliae siue radius sidereomysticus a very influential work on optics and astronomy",English
"ilex in latin means the holm-oak or evergreen oak quercus ilex despite the linnaean classification of ilex as holly as late as the th century in britain the term ilex was still being applied to the oak as well as the holly – possibly due to the superficial similarity of the leaves the name ""holly"" in common speech refers to ilex aquifolium specifically stems with berries used in christmas decoration by extension ""holly"" is also applied to the whole genus the origin of the word ""holly"" is considered a reduced form of old english holeġn middle english holin later hollen the french word for holly houx derives from the old low franconian *hulis middle dutch huls both are related to old high german hulis huls as are low germanlow franconian terms like hülse or hulst these germanic words appear to be related to words for holly in celtic languages such as welsh celyn breton kelenn and irish cuileann",English
então em  durante uma turnê americana ela cantou home sweet home de john howard payne na casa branca para o presidente dos estados unidos abraham lincoln e sua esposa mary lincoln os lincolns estavam de luto pela morte de seu filho willie que havia morrido de tifo emocionados com a interpretação os lincoln pediram bis da música esse fato tornou-se característica de patti e ela em todos seus recitais e concertos cantava uma música bonus,Portugese
a área da vila assunção vila conceição sétimo céu as duas primeiras quadras do bairro tristeza mais próximas ao lago guaíba e a pedra redonda é considerada a primeira praia balneária da cidade de porto alegre tendo sido muito procurada por compradores a partir da década de  normalmente os moradores das ruas duque de caxias e coronel fernando machado no centro histórico da cidade bem como dos bairros independência e moinhos de vento e do outrora nobre entorno do parque da redenção tinham residências de fim-de-semana e balneário na região,Portugese
douilly é uma comuna francesa na região administrativa da picardia no departamento de somme estende-se por uma área de  km² em  a comuna tinha  habitantes densidade  habkm²,Portugese
"many students and teachers were enlisted during world war i which had a significant effect on life at columbia pupils in assembly regularly delivered patriotic ""four-minute speeches"" every room in the school had a full complement of war posters",English
tom fogerty ingressou na carreira musical em  assim como seu irmão john fogerty participava de uma banda de rock denominada spider webb and the insects a qual chegou a assinar contrato com a gravadora del-fi records cancelado pouco tempo depois em ,Portugese
in the school year -  of the students were african american and  were caucasian within this black-and-white composition are found a variety of ethnic backgrounds including jamaican nigerian haitian african-american english french jewish polish italian and irish there has been much discussion regarding the racial academic achievement gap in the school district and the tracking is often cited as the most glaring example of a racial disparity,English
ilex  or holly is a genus of  to  species of flowering plants in the family aquifoliaceae and the only living genus in that family the species are evergreen or deciduous trees shrubs and climbers from tropics to temperate zones worldwide,English
david kent born  is an australian music historian and pop culture writer kent produced the kent music report compiling the national music chart from may  to  it was known as the australian music report from  the music reports were a weekly listing of the national top  chart positions of singles and albums kents music reports were used by australian recording industry association aria as its official aria charts from mid- until july  when aria developed an in-house chart,English
coid j yang m ullrich s romilly c gunn j moffitt te and farrington dp  childhood antecedents of personality disorder and psychopathy in,Portugese
maurice herzog sport complex including athletics training tracks football space archery practicing area gymnastic room climbing wall a table tennis room,English
faz fronteira a norte e a este com a suíça cantão do tessino a este com a província de como a sul com a província de milão e província de monza e brianza e a oeste com a região do piemonte província de novara e província do verbano cusio ossola,Portugese
a órbita de  do tem uma excentricidade de  e possui um semieixo maior de  ua o seu periélio leva o mesmo a uma distância de  ua em relação ao sol e seu afélio a  ua,Portugese
hanna is currently on the board of victim support service and is patron of numerous local sporting clubs he was the longest-serving member of the seaview high school governing council and had been president of friends of glenthorne and the reynella business  tourism association,English
on  july  katsikas signed a year contract with the dutch club twente for an undisclosed fee twente coach alfred schreuder was pleased with this transfer as he could build on katsikas experience on  september  in the training katsikas has suffered a cruciate ligament rupture and he is going to undergo a surgery which makes him miss the remainder of the season the greek centre back is expected to stay on the sidelines for six to nine months missing potentially the start of twentes pre-season over the summer  on  august katsikas made his comeback in the awaygame against fc groningen,English
one oj- modiﬁed in early  with an naca-type cowling and enclosed cockpits was delivered for trials as the xoj- but after a crash it was rebuilt and returned to service as an oj-,English
kabaena é uma ilha da indonésia no mar das flores com área de  km² na província de celebes do sudeste fica a sul de celebes sulawesi,Portugese
durante o filme trechos da cantiga de freddy aparecem escritos em várias partes mas a parte do ¨sete oito fique acordado¨ não aparece em lugar algum sugerindo uma possível edição,Portugese
segundo o censo norte-americano de  a sua população era de  habitantes em  foi estimada uma população de  um decréscimo de  -,Portugese
a capable rough-hewn leading man his toothy grin and lanky physique made him a perfect tough guy in numerous leading and supporting roles in westerns and action films such as the magnificent seven hell is for heroes the great escape charade our man flint in like flint duck you sucker and cross of iron coburn provided the voice of henry waternoose in the pixar film monsters inc,English
"david kent was born in sydney australia he listened to local radio broadcasts of top hits such as ""rock around the clock"" by bill haley in ",English
in  coburn starred in the zapata western duck you sucker with rod steiger and directed by sergio leone as an irish explosives expert and revolutionary who has fled to mexico during the time of the mexican revolution in the early th century this was not as highly regarded as leones four previous westerns but was hugely popular in europe especially france,English
it is the location of foel grochan a slate quarry which together with hen chwarel and ceunant ddu formed the aberllefenni slate quarry which extracted rock from mediaeval times until the beginning of the st century,English
a maior multidão presente para assistir a um evento no scottrade center foi de  visitantes o que aconteceu duas vezes durante a missouri valley conference tournament em  conhecida como arch madness,Portugese
the work of colston westbrook with los angeles police departments ccs criminal conspiracy section and the state of californias sacramento-based cii criminal identification and investigation unit and,English
les borgnes sont rois é um filme de drama em curta-metragem estadunidense de  dirigido e escrito por michel leroy e edmond séchan venceu o oscar de melhor curta-metragem em live action na edição de ,Portugese
katie foi anunciada como uma das protagonistas da série americana faking it da mtv que estreou em  de abril de  katie interpreta karma uma adolescente que para ser notada na escola inicia um romance gay de mentira com sua melhor amiga amy interpretada por rita volk,Portugese
em maio de  a estação já tinha sido concluída situava-se originalmente a cerca de  m de distância da vila e tinha acesso por um largo construído na estrada de ermidas-sado a sines,Portugese
whats up chuck  award-winning investigative story about the curious relationship between big insurance and the california insurance commissioner chuck quackenbush,English
on november   the group released their sixth studio album set in stone set in stone peaked at no on the billboard reggae albums chart and spent  weeks on the chart it appeared on six billboard charts overall including no  on the billboard  no  on digital albums no  on heatseekers albums no  on independent albums and no  on the top album sales chart,English
her occupations include former director of marketing at chi-huan associates and mercenary she is a mutated humantechnology user and has been a member of the crimson cowls masters of evil joystick was a member of the thunderbolts which at the time also included atlas blizzard mach-iv photon radioactive man songbird and speed demon,English
subject matter experts such as journalist robert moore author of the novel upon which the film is based along with david russell commodore british royal navy who tried to save the men from kursk and submarine expert ramsey martin are advising the filmmakers,English
andrew shue born  class of  actor best known for his leading role on the television series melrose place he also appeared in the  film gracie and served as producer for it,English
weber pays special attention to brahmins and considers why they occupied the highest place in indian society for many centuries with regards to the concept of dharma he concludes that the indian ethical pluralism is very different both from the universal ethic of confucianism and christianity he notes that the varna system prevented the development of urban status groups,English
the news  review is a group of free alternative weekly newspapers published by chico community publishing inc of chico california the company publishes the chico news  review in chico california the sacramento news  review in sacramento california and the reno news  review in reno nevada,English
até a década de  as competições de voleibol no brasil só ocorriam em nível estadual sem nenhuma competição nacional até  também era disputada a taça brasil um torneio que só reunia equipes dos estados do rio de janeiro são paulo e minas gerais,Portugese
kent expanded his business and incorporated physical sales to supplement information from radio stations from  by  major record companies used his chart information in their advertising kents staff sent surveys to retail stores collated sales figures together with radio charts by states and then used his ranking system to assemble the national kent music report by  retail sales by survey was the main source of kents reports,English
john sutcliffe died  was a british fashion designer and fetish photographer famous in the s s and s as a designer of clothes for aficionados of leather rubber and pvc fetishism with an emphasis on rubber and leather catsuits cloaks and gasmasks,English
nas duplas a decisão sem cabeças de chave no masculino premiou pela primeira vez o norte-americano ryan harrison e o neo-zelandês michael venus a americana bethanie mattek-sands e a tcheca lucie safarova levantaram o quinto troféu de torneio grand slam sendo este o segundo roland garros da parceria nas mistas mais debutantes a canadense gabriela dabrowski e o experiente indiano rohan bopanna,Portugese
em  ac lars porsena rei de clúsio na época considerada a mais poderosa cidade da etrúria partiu de roma depois de encerrar sua guerra contra roma com um tratado de paz porsena dividiu suas forças e enviou parte do exército clúsio com seu filho aruns para cercar a cidade latina de arícia os aricianos pediram ajuda da liga latina e também da cidade grega de cumas quando a ajuda chegou o exército ariciano saiu da muralha e os exércitos combinados enfrentaram as forças clúsias em combate segundo lívio os clúsios inicialmente arrasaram os aricianos mas as tropas cumanas permitiram o avanço clúsio e depois os atacaram pela retaguarda conseguindo a vitória segundo lívio o exército clúsio foi destruído,Portugese
in a closing prosecution statement that hardly made mention of hearst having been kidnapped prosecutor browning suggested hearst had taken part in the bank robbery without coercion browning also suggested to the jury that the female sla members being into feminism would not have allowed hearst to be raped he said that hearst having kept an olmec carving given to her by wolfe showed that she had lied about being subjected to rape by him,English
"hamilton first played with grateful dead bassist phil lesh on march –  at leshs terrapin crossroads in san rafael ca as a member of phil and friends this was followed by another concert at terrapin crossroads on october   which was billed as ""east coast all-stars"" and a three night run on december – to close out  at the capital theatre in port chester ny billed as ""philrad""",English
back at fox coburn made a second flint film in like flint  which was popular but coburn did not wish to make any more he went over to paramount to make a western comedy waterhole no   and the political satire the presidents analyst  neither film performed particularly well at the box office but over the years the presidents analyst has become a cult film in  coburn was voted the twelfth biggest star in hollywood,English
vulnerable is the third posthumous album by marvin gaye recorded in sessions throughout  the album was a decade in the making first being worked on in  during sessions in new york with bobby scott reworked by gaye a decade later the album was originally going to be released in  under the title the ballads but was shelved two decades later motown released it under the title vulnerable including seven songs from the sessions and three alternate cuts,English
"the world branding forum is the organiser of the world branding awards an international award presented to some of the best global and national brands for their work and achievements in branding it is also the owner of the awards ""brand of the year"" logo which is a registered trademark",English
este filme fascinante conta a história de uma estudante que mora com a mãe viúva e estuda astronomia na universidade do outro lado da rua mora stella com o marido e a filha haris o estudante acompanha a vizinha pelo seu telescópio e pouco a pouco começa a ficar obcecado por ela haris começa a afastar-se cada vez mais dos amigos e mergulha na vida de stella,Portugese
"apesar disso alguns dias depois confirmou-se que as negociações entre a th century fox e a tbs estavam em ""estágio preliminar"" a tbs decidiria no prazo de um dia se iria encomendar a produção de  episódios ou não dois dias depois foi revelado que o acordo com a tbs foi impossibilitado devido à incapacidade da emissora em fazer um acordo sem ""minar seriamente a integridade artística da série"" em seguida um porta-voz da th century fox anunciou que o seriado estava ""oficialmente morto""",Portugese
coburns film debut came in  as the sidekick of pernell roberts in the randolph scott western ride lonesome he soon got a job in another western face of a fugitive ,English
os álbuns mais bem vendidos no total em  foi o álbum exile love do grupo de rb exile lançado ao final de  que vendeu mais de  cópias o segundo álbum mais bem vendido foi best fiction de namie amuro que vendeu mais de  cópias seguido pela banda de pop folk kobukuro com o álbum  com quase  de álbuns vendidos o quarto e quinto álbum mais vendido foram exile catchy best de exile e heart station da cantora pop hikaru utada respectivamente exile catchy best vendeu mais de  copias enquanto heart station vendeu um pouco mais de  cópias,Portugese
in  page received an honorary doctorate from the university of michigan during a graduation commencement ceremony in  he was ranked th on the forbes list of billionaires and as the th richest person in the us,English
linus yale jr improved upon his fathers lock in  using a smaller flat key with serrated edges that is the basis of modern pin-tumbler locks yale developed the modern combination lock in ,English
the australian recording industry association aria was established by the six major record companies operating in australia emi festival records cbs now known as sony music rca now known as bmg wea now known as warner music and polygram now known as universal aria licensed the kent music report from mid- to publish the aria charts under their banner until the week ending  june  aria had established its own research and chart publishing group and now competed with the kent music report,English
" entire web was loosely based on the premise of citation—after all what is a link but a citation? if he could devise a method to count and qualify each backlink on the web as page puts it ""the web would become a more valuable place""",English
copérnico seu trabalho sobre o heliocentrismo foi conhecido devido a um astrólogo - reticus - que o imprimiu e acrescentou com o consentimento do autor um capítulo sobre astrologia paracelso botânico nostradamus tycho brahe médico e astrônomo galileu kepler e newton estudaram e usaram a astrologia,Portugese
melor manteve sua intensidade por cerca de  horas antes de começar a se enfraquecer lentamente em  de outubro assim que o ciclone começou na seguir para noroeste melor deixou de ser um super tufão segundo o jtwc na madrugada de  de outubro assim que suas áreas de convecção associadas começaram a ser afetadas negativamente pelos fortes ventos do oeste ao mesmo tempo melor começou a seguir mais para norte assim que alcançou a borda oeste da alta subtropical que o guiava naquela noite melor começou a ser afetado por cisalhamento do vento assim que passou abaixo do jato subtropical na altura do paralelo °n assim que seguia para norte com isso melor ficou mais assimétrico e começou a se enfraquecer mais rapidamente melor começou a sofrer transição extratropical na tarde de  de outubro assim que começava a se interagir com a forte zona baroclínica situada aos arredores do japão ao mesmo tempo o tufão se enfraquecia rapidamente devido às condições meteorológicas mais desfavoráveis como águas oceânicas mais frias mais tarde naquele dia melor fez landfall na costa de honshu japão a oeste de tóquio com ventos de até  kmh logo em seguida no início,Portugese
é decretado pela rainha majestade excelentíssima por e com o conselho e consentimento do lords espirituais e temporais e comuns neste atual parlamento montado e pela autoridade do mesmo é como se segue,Portugese
the colt lightning carbine or colt lightning rifle was a slide-action pump-action rifle manufactured by colt from  to  and was originally chambered in - caliber colt eventually made the lightning rifle in three different frame sizes to accommodate a wide range of cartridges from  short caliber and - to - express its profile somewhat resembles the pump-action rimfire rifles made by the winchester repeating arms company and remington arms the lightning saw use as a sporting arm in america and was adopted for use by the san francisco police department but was never as popular or as reliable as the various lever-action rifles of its day,English
